{
  "subject": "Authentication Refactor & Session Management",
  "verdict": "Adequate",
  "verdict_justification": "The refactor implements the core session lifecycle correctly, but contains an unhandled race condition in token renewal and lacks audit logging for revocation events.",
  "metadata": {
    "generated": "2026-09-16",
    "applies_to": "commit a1b2c3d",
    "source": "src/auth/session.ts, src/auth/token.ts"
  },
  "standard": [
    "OWASP Session Management Cheat Sheet requirements",
    "Session renewal must be race-condition free under concurrent requests",
    "All security-sensitive events must produce audit log records",
    "Type-safe error returns with no raw exception leakage"
  ],
  "requirements": [
    {
      "requirement": "Cryptographically secure token generation",
      "status": "Fully satisfied",
      "evidence": "Uses crypto.randomBytes(32) with constant-time comparison",
      "severity": "Low"
    },
    {
      "requirement": "Atomic session refresh under concurrency",
      "status": "Partially satisfied",
      "evidence": "Refresh token rotation exists but lacks mutex locking during DB write",
      "severity": "High"
    },
    {
      "requirement": "Session revocation audit telemetry",
      "status": "Missed",
      "evidence": "revokeSession() deletes database record without emitting log event",
      "severity": "Medium"
    }
  ],
  "issues": [
    {
      "id": 1,
      "title": "Concurrent refresh token rotation window",
      "severity": "Critical",
      "why_it_matters": "Simultaneous API requests with the same refresh token trigger double rotation errors and revoke the session.",
      "impact": "Legitimate active users get logged out unexpectedly when opening multiple tabs.",
      "evidence": "src/auth/session.ts:142 has a 200ms window between read and invalidate.",
      "confidence": "High",
      "proposed_fix": "Use atomic database CAS (compare-and-swap) or Redis mutex lock on refresh token consumption.",
      "fixed": true,
      "commentary": "Implemented atomic compare-and-swap update query in src/auth/session.ts with 500ms grace window for in-flight requests."
    },
    {
      "id": 2,
      "title": "Missing revocation audit trail",
      "severity": "Important",
      "why_it_matters": "Security incident response cannot verify who terminated an active session.",
      "impact": "Compliance failure against SOC2 telemetry standards.",
      "evidence": "src/auth/session.ts:189 invokes deleteSession directly with no logger call.",
      "confidence": "High",
      "proposed_fix": "Add auditLog.emit('session.revoked', { userId, sessionId, timestamp }) before DB deletion."
    },
    {
      "id": 3,
      "title": "Token expiry error message exposes server clock skew",
      "severity": "Minor",
      "why_it_matters": "Error string includes exact epoch timestamp difference.",
      "impact": "Minor information disclosure, low exploitation value.",
      "evidence": "src/auth/token.ts:55 returns error `Token expired by ${delta}ms`.",
      "confidence": "Medium",
      "proposed_fix": "Return generic `Token expired` error string to client."
    }
  ],
  "dismissed": [
    "Memory leak in session cache — cache is bounded LRU with 10k items and TTL eviction, memory remains stable."
  ],
  "verification": [
    {
      "claim": "Node.js crypto.randomBytes uses CSPRNG",
      "classification": "Established",
      "source_note": "Official Node.js documentation; backed by OpenSSL RAND_bytes"
    },
    {
      "claim": "Token rotation prevents replay attacks without grace periods",
      "classification": "Contradicted",
      "source_note": "RFC 6749 Section 10.4 recommends grace period or atomic lock to handle network race conditions"
    }
  ],
  "unknowns": [
    {
      "what": "Database write latency under peak load",
      "why_unknown": "No production-equivalent load testing conducted",
      "what_would_resolve_it": "Run k6 load test simulating 500 concurrent renewals",
      "materiality": "Determines whether CAS lock requires an external Redis coordinator"
    }
  ],
  "strengths": [
    "Constant-time token comparison prevents timing attacks",
    "Clean separation of token issuance and session persistence concerns"
  ],
  "regrets": [
    "Did not model concurrent refresh token edge cases during initial architecture review"
  ],
  "process_changes": [
    "Add concurrency integration tests for any stateful credential exchange protocol"
  ],
  "plan_1hr": [
    "Implement compare-and-swap update query for refresh token rotation",
    "Add audit log emit on session revocation"
  ],
  "plan_unlimited": [
    "Extract distributed session coordinator service with formal TLA+ state machine verification"
  ]
}
